id,title,description,group
1280,Mother and son grifters who were ‘like a couple’ murdered wealthy socialite over NYC townhouse: ‘Evil energy’,New York City socialite Irene Silverman vanished in 1998. Las Vegas residents Sante Kimes and her son Kenneth Kimes were the grifter team connected to her disappearance.,95
2317,South African Inquiry Rebuts U.S. Charge on Russian Arms,"A government investigation about a Russian ship contradicts U.S. accusations that South Africa provided arms to fight Ukraine, President Cyril Ramaphosa said. But a government report won’t be released, he added.",87
2561,Arizona 10-year-old caught speeding in car as father sat in the passenger seat: police,"Arizona father Alvaro Ovando Alvarez was arrested for aggravated DUI, child abuse and other charges after he was found in the passenger seat of a car his child was driving.",81
2562,Squatters ravage Wyoming downtown with stomach-turning result: mayor,"Casper, Wyoming, has at least 200 homeless people who squat in the closed Econo Lodge or private homes and defecate in the street, the mayor says.",1
3110,Pelosi Pushes Back on Calls for Feinstein to Resign,"The longtime Democratic leader, who has served in the House for close to four decades, also left the door open to running again.",31
3111,"Bill Gates, Marie Kondo and World Bank Head Will Speak at Times Climate Event","Sign up to watch the livestream and connect with online attendees about solutions to the climate crisis on Thursday, Sept. 21.",4
3112,Biden Says He Will Nominate Michael Whitaker to Lead FAA,"The president’s selection, Michael G. Whitaker, served as the No. 2 official at the Federal Aviation Administration during the Obama administration.",53
3113,Presidential Centers Call for Protecting Democracy,A rare statement released jointly from groups representing nearly a century of presidents stresses the importance of the pillars of democracy and civility in politics.,25
3032,‘Swing State’ Playwright Wants to Sound an Alarm for a World in Trouble,"In her Off Broadway drama, which had an acclaimed run in Chicago, the playwright looks for hope to outweigh despair in a fractious, anxious time.",4
3033,"Ukrainians Embrace Cluster Munitions, but Are They Helping?","The weapons, banned by most countries over human rights concerns, are “not a magic wand,” but some Ukrainian troops say they are making a difference in fighting Russian forces.",22
3390,Dog lost at Atlanta airport found safe 3 weeks after mysterious disappearance: officials,A traveler&apos;s dog that escaped from its crate survived three weeks on its own before it was found on the grounds at Hartsfield-Jackson International Airport in Atlanta.,47
3977,The 2024 Executive Power Survey,We asked candidates about presidential authority. Here is what they said.,84
2129,Massachusetts troopers and FBI agents respond to American Airlines flight in Boston for reported criminal act,The FBI and Massachusetts State Police responded to reports of a &quot;potential criminal act&quot; on an American Airlines flight heading to Boston on Saturday morning.,66
1356,"MS-13 and Mexican Mafia leader sentenced to 17 years for massive trafficking of meth, cocaine across border","MS-13 leader Nelson Alexander Flores, aka &apos;Mula,&apos; was sentenced to 210 months for moving more than 100 pounds of meth and cocaine per month.",108
1357,"Washington deputy barks like police K-9, tricks teen car theft suspects into surrendering: video","Four juveniles in Pierce County, Washington, were arrested after a deputy barked like a police dog to trick the group into surrendering.",47
1358,DC begins enforcing curfew to deter youth crime after teen's fatal stabbing over McDonald's sauce packet,"Washington, D.C., began its &quot;Juvenile Curfew Enforcement Pilot&quot; a week after 16-year-old Naima Liggon was stabbed to death in a dispute over a sauce packet.",1
2284,Alleged drunk driver accidentally reports himself to 911 in bizarre highway incident: 'dumb f---',"A Lancaster, Nebraska, sheriff&apos;s deputy busted an alleged drunk driver who reported himself to 911 after seeing who he thought was a driver going down wrong side of highway.",90
2211,Mexico places piece of Berlin wall near US border: 'May this be a lesson',"Mexican officials are comparing the U.S. border wall to the Berlin Wall that Soviets used to divide Germany, placing a piece just feet away from San Diego.",41
1279,Death at Burning Man festival investigated as flooding strands thousands in Nevada desert,The Pershing County Sheriff&apos;s Office in northern Nevada reportedly said a death at the Burning Man festival is being investigated amid heavy flooding.,63
3139,I.R.S. Deploys Artificial Intelligence to Catch Tax Evasion,"The tax agency is opening examinations into large hedge funds, private equity groups, real estate investors and law firms.",61
3103,What $50 Million Can Buy: Inside the Sleek New White House Situation Room,"The ultrasecure facility, which was last upgraded in 2006, is returning to use after officials closed it for a year to modernize it in an era of high-tech sparring with China and Russia.",24
3141,"At G20 in India, Biden Looks to Fill a Hole Left by Putin and Xi","With the Russian and Chinese leaders absent, the president hopes to get others to align with him on a variety of matters, including Ukraine and curbing Beijing’s assertiveness in the Indo-Pacific.",17
3135,"Manchin Mulls His Political Future, Keeping Washington Guessing","The West Virginia Democrat could run for re-election to the Senate, make a third-party presidential bid or simply retire from politics. To his party’s consternation, he’s not ready to say which.",31
3132,Justice Alito Rejects Calls for Recusal After Interviews in Wall Street Journal,The justice dismissed demands from Democratic legislators that he recuse himself from a pending case involving a lawyer who interviewed him.,0
3133,"Kristi Noem, Likely to Endorse Trump, Kicks Off Fight to Be His V.P.","At a rally on Friday, Gov. Kristi Noem of South Dakota threw her support behind the former president, whose large lead in polls has stirred speculation about the No. 2 job.",48
3136,"Pelosi, Defying Predictions, Says She Will Seek Re-election in 2024","Since she stepped down from leadership last year, many observers expected Representative Nancy Pelosi of California to head toward retirement. But she has kept people guessing about her future.",31
3137,"DeSantis, Undaunted by Florida Storms, Shrugs Off Climate Change","The Florida governor, who has cast himself as a Teddy Roosevelt-style conservationist, sounds far different as a presidential candidate, pledging to expand fossil fuel production and fight electric-vehicle mandates.",60
3138,Border Crisis Comes to Blue Cities After Migrants Are Bused North,"The strain of migrants in New York, Chicago, Los Angeles and other cities has taxed resources, divided Democrats and put pressure on President Biden to act.",1
3134,Liberty Safe Backlash: How a Gun Safe Maker Angered Gun Owners,Liberty Safe faced intense criticism this week after it acknowledged that it had voluntarily given the F.B.I. the access code to a safe in response to a search warrant for a property.,47
4003,Mitt Romney’s startling but familiar concession: The demagogues have won,Mitt Romney’s retirement comments hark back to another Mormon Republican’s six years ago.,78
4004,Should the 14th Amendment keep Trump out of the White House?,"What the 14th Amendment says, how it works, the argument for keeping Trump off the ballot",88
4005,"TikTok and U.S. rekindle negotiations, boosting app’s hopes for survival",Calls to ban the wildly popular app have faded ahead of the 2024 election.,35
4006,"ICE can’t keep up with complex money laundering schemes, watchdog warns",Outdated technology and short staffing hinder the government’s ability to combat sophisticated money laundering schemes by drug traffickers and terrorists.,80
4007,Biden circle fires back hard at impeachment inquiry,"President Biden has sought to remain above the fray, but his staffers — and son — have responded aggressively.",10
4008,"Hunter Biden indicted on false statement, gun charges in Delaware",Hunter Biden has been indicted -- a legal and political setback for President Biden and his family after a plea deal fell apart this summer.,10
3142,Republican vs. Republican: Senate seeks to wrest control over House in budget,"With House Republicans bitterly divided over Ukraine funding and other priorities, a mostly unified Senate wants to force the House into accepting the Senate’s position on government funding.",26
3151,Former speaker Nancy Pelosi says she will run for reelection to House in 2024,Pelosi’s decision came amid speculation about her political future after she stepped down as leader of the House Democratic caucus.,31
3159,Fla. Supreme Court justices question long-standing abortion protections,The case could pave the way for one of the country’s most far-reaching abortion bans.,74
3160,A timeline of the DeSantis-Disney feud,The entertainment giant’s feud with Florida’s Republican governor stretches back more than a year. Here’s how it developed.,60
3161,"DeSantis voiced complaints about top super PAC strategist, people familiar with comments say","DeSantis was “apoplectic” over a pre-debate strategy memo publicly posted on the website of Jeff Roe’s firm, according to one person familiar with the comments",52
3147,"What we know about Grassley, Pence and Jan. 6",Theories — often unsubstantiated ones — have abounded about Grassley rather than Pence presiding over the electoral vote counting that day. Here’s what we know.,97
3163,Peter Navarro convicted of contempt for defying Jan. 6 panel subpoena,Navarro is the second high-ranking Trump official to be convicted of contempt of Congress after former Trump adviser Stephen K. Bannon’s conviction last summer.,20
3174,Convicted murderer's death in Indiana prison being investigated as homicide,"The death of double homicide convict Victor Glenn, 44, at the Indiana State Prison, is being investigated as a homicide, according to state police.",6
3175,St. Louis-area municipal worker accused of running over TV photojournalist,"A municipal worker in Hillsdale, Missouri, has been arrested after allegedly running over a television station&apos;s photojournalist, seriously injuring him.",68
3176,Pennsylvania prison guard who missed killer Danelo Cavalcante's escape is fired,"The prison guard in Pennsylvania who missed the escape of Danelo Cavalcante on Aug. 31 has been fired, a county spokesperson said on Friday.",65
3177,"Utah mommy blogger accused of child abuse appears in court, will remain jailed without bond","Utah parenting blogger Ruby Franke, who is accused of abusing two of her six children, along with her business partner, appeared in court for the first time on Friday.",81
3178,"Fourth man charged over threats, vandalism targeting NH journalists","Eric Labarge, 46, of Nashua, New Hampshire, has been arrested and charged in connection with a plot to vandalize homes associated with two New Hampshire Public Radio employees.",104
3179,Baltimore school police officer charged with $215K overtime fraud scheme,"Lawrence Smith, a 49-year-old Baltimore school police officer, has been arrested and charged with fraudulently obtaining over $215,000 in overtime pay.",8
3180,"Australian tourist kills California couple in their 80s while driving the wrong way, authorities say","An Australian man has been charged in the deaths of a California couple in their 80s during a vehicle collision in which he drove the wrong way on a roadway, prosecutors said.",62
3181,"Alligator that evaded New Jersey authorities for more than a week, forcing park shutdown, captured",New Jersey authorities finally captured a 4-foot alligator that had been on the loose for more than a week. Alligators aren&apos;t native to New Jersey,120
3182,No charges for Maine officers involved in death of suspect struck with flashlight,Maine&apos;s attorney general has found no evidence of criminal conduct by four police officers responding to an ill-fated call involving Jeremy Lau.,8
3183,"Peloton sued after NYC man's bike falls on his neck, killing him","Johanna Furtado is seeking unspecified damages from Peloton in a lawsuit over the death of her 32-year-old son, Ryan, whose exercise bike fell on his neck.",3
3184,Murder charges upgraded in UVA football player shooting case,Murder charges against the man accused of the fatal shooting of three University of Virginia football players last year have been upgraded to aggravated murder by a special grand jury.,21
3168,Texas man who pleaded guilty to killing wife with nail gun sentenced to 40 years in prison,A Texas man who bludgeoned his wife to death with a nail gun has been sentenced to 40 years in prison. He pleaded guilty to the murder earlier this year.,111
3152,"No, most Americans don’t think that the 2020 election was stolen","Despite the lack of evidence, most Republicans still do.",35
3153,Biden arrives in New Delhi hoping to boost U.S.-India alliance,U.S. officials pointedly note the absence of Xi and Putin at the G-20 summit,17
3154,Alito will not recuse in case involving lawyer who interviewed him,A lawyer in an upcoming tax case interviewed Justice Samuel A. Alito Jr. for a Wall Street Journal article in which Alito refuted criticism of his conduct.,0
3155,White House completes $50 million revamp of Situation Room complex,"The year-long renovation of the Situation Room, a network of rooms spanning more than 5,000 square feet, upgraded the facility’s security, technology and upholstery.",24
3145,A reminder of how one juror could save Trump,"A single grand juror voted against recommending every charge against Trump, reinforcing the potential importance of Trump’s loyal base in the legal battles ahead.",88
3146,Mark Meadows’s credibility issue,A close parsing of the most controversial portion of his testimony: distancing himself from the fake-elector push.,33
3144,"5th Circuit finds Biden White House, CDC likely violated First Amendment ","The judges wrote that the White House, the Surgeon General, the CDC and the FBI likely “coerced the platforms to make their moderation decisions by way of intimidating messages and threats of adverse consequences.”",116
3143,Jan. 6 shattered her family. Now they’re trying to forgive.,"Peyton Reffitt watched her family come apart after Jan. 6. More than two years after Guy Reffitt was turned in by his son, she and her family are trying to pick up the pieces.",37
3148,Judge denies Mark Meadows’s effort to move Georgia case to federal court,The ruling is a blow to Meadows’s efforts in federal court to dismiss his case and could influence former president Donald Trump as he decides whether to seek removal himself.,12
3149,"Dennis Austin, the software developer of PowerPoint, dies at 76",PowerPoint was the overhead projector’s digital successor. It became one of the most ubiquitous and scorned programs of modern office life.,119
3150,Justice Department asks Supreme Court to ensure access to abortion pill,The request creates an opening for the Supreme Court to decide when and how mifepristone can be prescribed and distributed to end early pregnancy.,19
3157,Why polls with more respondents from one party aren’t necessarily wrong,An interactive look at how polling works.,48
3158,Musk cut internet to Ukraine’s military as it was attacking Russian fleet ,New details of the previously reported incident underscore how dependent the U.S. government has become on a company that once had to fight in court to become part of the Washington establishment.,87
3165,911 call reveals shock of Utah mommy bloggers' alleged child abuse: 'She's a bad lady',"A 911 call revealed the shock of the child abuse accusations against Utah mommy bloggers Ruby Franke and Jodi Hildebrandt, who were arrested Aug. 30.",81
3166,Cold case kidnapping takes drastic turn after cops rule out prime suspect,"Police uncovered new evidence that changes the 23-year-old investigation into missing 10-year-old Natasha &quot;Alex&quot; Carter, who hasn&apos;t been seen since 2000.",118
3167,Green comet to streak across Earth skies for first time in centuries,"A comet will pass by Earth for the first time in more than 400 years, with people in the Northern Hemisphere likely able to catch a glimpse of it on Sept. 12.",50
3169,California scientist says he ‘left out the full truth’ to get climate change wildfire study published,A California scientist admitted he &quot;left out the full truth&quot; and &quot;distorted his findings&quot; in order to get his climate change wildfire study published in a prestigious journal.,4
3170,Chicago man beaten and carjacked by group of females in violent attack,"A Chicago rideshare driver was attacked by a group of females who beat him and stole his vehicle, authorities said.",59
3171,New York announces two 9/11 victims identified 22 years after attack,"Days from marking 22 years since the 9/11 terrorist attacks that killed nearly 3,000 people in New York City, officials said two victims have been identified.",57
3172,"In update on Maui wildfires, Hawaii Gov. Josh Green says number of missing people has fallen to 66","Hawaii Gov. Josh Green on Friday said 66 people are still missing after the deadly Maui wildfires a month ago, down from 385 people a week ago.",103
3173,New Jersey couple uncovers hidden stash of empty rum bottles behind basement wall: 'It's 5 o'clock somewhere',A New Jersey couple found a stream of empty rum bottles hidden in a basement wall of their new home.,104
3216,"After G-20, Biden arrives in Vietnam to strengthen diplomatic ties",President Biden headed to Hanoi for a 24-hour stop aimed at upgrading the diplomatic relationship between Vietnam and the United States.,44
3131,Here Are the 20 Oldest Members of Congress,"Congress has long been an institution that runs on seniority and rewards longevity, and these veteran lawmakers are still running the country at an age when most people are well into retirement.",64
3208,"Seeking Link to Trump, Prosecutors Questioned Proud Boys Leader Enrique Tarrio","Enrique Tarrio said in an interview that prosecutors believed he had communicated with President Donald Trump through intermediaries before the Jan. 6, 2021, attack on the Capitol.",72
3127,Trump’s Resilience Leaves Major Republican Donors in Despair,"The party’s big donors have made clear their distaste for the former president. Now, as he barrels toward the nomination, they are reacting with a mix of hand-wringing, calls to arms and fatalism.",56
3205,"In a Blunt Phone Call, Trump Weighs In on Arizona Senate Race","The former president made clear his preference in a potential primary between Blake Masters and Kari Lake, the most prominent names considering a run for the seat held by Senator Kyrsten Sinema.",40
3130,Justice Dept. Asks Supreme Court to Hear Abortion Pill Case,The case sets up a showdown before the court on the availability of the most common method of terminating pregnancies.,19
3217,GOP presidential hopefuls take renewed aim at efforts to combat covid,Scattered measures to mitigate the rise in coronavirus cases have been vilified during the campaign.,17
3218,"Trump and DeSantis converge again in Iowa at rivalry game, with different styles",Donald Trump and Ron DeSantis converged again at the Cy-Hawk college football game in Iowa on Saturday as they bet on very different approaches to the first-in-the-nation GOP caucuses.,52
3126,Gavin Newsom Promotes Biden and Himself in a Delicate Dance,The California governor has become the most visible Democrat-in-waiting. His support of the president is a key part of his effort to put himself forward for the next campaign.,62
3222,"N.M. governor announces suspension of open, concealed carry in Albuquerque","New Mexico Gov. Michelle Lujan Grisham says the move, which applies to public spaces, is needed to slow gun violence, though some question whether it violates Second Amendment rights.",7
3321,NYC Mayor Adams warns migrant women and children may soon have to sleep outdoors in tents,"New York City Mayor Eric Adams appeared on MSNBC&apos;s The Sunday Show with Jonathan Capehart, where he said the ongoing migrant crisis is a national problem.",1
4009,"After chaotic week, House heads home with government shutdown on horizon",Speaker Kevin McCarthy challenged his Republican detractors to oust him as the House swirled with chaos after a short week.,26
3315,'The miracle of Stairwell B': The story of the 14 survivors of the north tower collapse on 9/11,"Stairwell B provided a safe haven for 14 people on Sept. 11, 2001, as the north tower of the World Trade Center collapsed around them.",57
3317,"A timeline of events from Sept. 11, 2001","On the morning of Sept. 11, 2001, the devastating events of the day began with four planes being hijacked. A timeline reveals how quickly the tragedy unfolded.",27
3319,"Phone conversations from the hijacked planes on 9/11 reveal details on passengers' bravery, heroism","On Sept. 11, 2001, passengers and crew on the four hijacked planes called friends, family members and emergency services. The calls were used to exchange goodbyes and information.",27
3323,Ohio cops rescue piglet on side of highway after suspected fall from transport,"Bodycam video from state troopers in Ohio shows a piglet being rescued on the side of a highway, after the animal suffered road rash.",39
3275,Congress Embarks on Spending Battle as Shutdown Looms at End of September,The House returns this week with conservatives threatening both spending levels and Speaker Kevin McCarthy.,26
3197,President Biden Keeps Hunter Close Despite the Political Peril,The possibility of a federal indictment of Hunter Biden stunned the president. Yet the bond between him and his only surviving son is ironclad.,10
3198,J.F.K. Assassination Witness Breaks His Silence and Raises New Questions,"The account of Paul Landis, one of the Secret Service agents just feet away from John F. Kennedy when he was struck down, could change the understanding of what happened in Dallas in 1963.",114
3273,Biden Forges Deeper Ties With Vietnam as China’s Ambition Mounts,"Visiting Hanoi, the president cemented a new strategic partnership that puts the memories of the past behind them and focuses on mutual concerns over Beijing’s assertiveness in the region.",44
3293,Biden visits Vietnam to bolster alliance confronting China,President Biden visited Hanoi for a 24-hour stop aimed at upgrading the diplomatic relationship between Vietnam and the United States.,44
3224,"At G-20, Biden announces ambitious corridor connecting India, Europe",Biden administration officials view the project as a way to open up new trading partnerships as well as a flow of energy and digital information.,53
3316,Chicago police officers hospitalized after suspect unleashes violent dogs on them,Three Chicago Police Department officers were injured after two aggressive dogs attacked them in West Garfield Park on Sunday morning. The dog owner is unknown.,47
3320,"School hid teen's gender transition from parents, leading to runaway, abuse nightmare: lawsuit","A family are suing a Virginia school district, claiming the district deliberately hid their daughter&apos;s gender transition that eventually resulted in the teen running away.",101
3318,Some National Guard units haven't followed order to ditch Confederate items: report,Army National Guard units in some southern states have allowed the deadline to pass without turning in Confederate-themed guidon streamers as mandated by Congress.,46
3339,The Race to Drill America's Longest Oil and Gas Wells,"With the shale boom’s end in sight, some companies are trying to impress Wall Street by eking out growth—and drilling ever deeper.",28
3322,Grizzly bear mauls Montana hunter in Custer Gallatin National Forest,"A hunter was injured after encountering a grizzly bear in Custer Gallatin National Forest near Big Sky, Montana, on Friday, authorities said.",96
3292,In photos: The 50th anniversary of the U.S.-backed coup in Chile,"On Sept. 11, 1973, Chilean Gen. Augusto Pinochet overthrew the elected government of President Salvador Allende and ushered in 17 years of military rule.",27
3314,"Sinkhole, 50 feet wide, forms in same Florida area as 75-foot sinkhole months earlier",A second large sinkhole has opened in Florida where construction is apparently taking place. It did not pose a threat to the county roadway or homes.,93
3294,The political perils of using the 14th Amendment on Trump,The idea of disqualifying Trump has suddenly gained traction. Here’s why Democrats are treating it gingerly.,88
3291,Pretrial-palooza underway for Trump,"Welcome to The Trump Trials, a weekly newsletter to catch you up on all four criminal trials former president Donald Trump is facing.",12
4010,Planned Parenthood in Wisconsin will resume offering abortions,Planned Parenthood and others stopped providing abortions in Wisconsin after the Supreme Court’s decision overturning the right to abortion and because of an 1849 state law that was broadly viewed as banning nearly all abortions.,74
4011,Ukrainian President Volodymyr Zelensky to visit Washington next week,"Zelensky’s visit was coordinated with the Biden administration in a joint push to Congress to provide $24 billion in aid, according to a person familiar with the matter.",44
4012,Supreme Court asked to pause limits on White House social media requests,The filing brings a long-simmering legal battle over the future of online speech before the nation’s highest court.,19
4013,The casual falsehoods of the GOP’s impeachment inquiry leader,Rep. James Comer (R-Ky.) offered a litany of unproven or false claims in an interview this week.,10
